{
  "id": "q-monthly",
  "version": 1,
  "source": "warehouse.orders",
  "sql": "SELECT date_trunc('month', ordered_at)::date AS month, SUM(amount) AS revenue\nFROM orders WHERE refunded = false AND year IN (2024, 2025)\nGROUP BY 1 ORDER BY 1;",
  "params": {},
  "run_at": "2026-10-20T14:01:47Z",
  "provenance": "agent-reported",
  "key": [
    "month"
  ],
  "columns": [
    {
      "name": "month",
      "type": "date"
    },
    {
      "name": "revenue",
      "type": "decimal"
    }
  ],
  "rows": [
    [
      "2024-01-01",
      "311540"
    ],
    [
      "2024-02-01",
      "298910"
    ],
    [
      "2024-03-01",
      "349430"
    ],
    [
      "2024-04-01",
      "336800"
    ],
    [
      "2024-05-01",
      "357850"
    ],
    [
      "2024-06-01",
      "345220"
    ],
    [
      "2024-07-01",
      "332590"
    ],
    [
      "2024-08-01",
      "341010"
    ],
    [
      "2024-09-01",
      "370480"
    ],
    [
      "2024-10-01",
      "378900"
    ],
    [
      "2024-11-01",
      "366270"
    ],
    [
      "2024-12-01",
      "421000"
    ],
    [
      "2025-01-01",
      "274170"
    ],
    [
      "2025-02-01",
      "263055"
    ],
    [
      "2025-03-01",
      "307515"
    ],
    [
      "2025-04-01",
      "296400"
    ],
    [
      "2025-05-01",
      "314925"
    ],
    [
      "2025-06-01",
      "303810"
    ],
    [
      "2025-07-01",
      "292695"
    ],
    [
      "2025-08-01",
      "300105"
    ],
    [
      "2025-09-01",
      "326040"
    ],
    [
      "2025-10-01",
      "333450"
    ],
    [
      "2025-11-01",
      "322335"
    ],
    [
      "2025-12-01",
      "370500"
    ]
  ],
  "row_count": 24,
  "data_hash": "sha256:fe7b838854e857efcd49a8f1064ef1f25ba1b1d2d1e9a8707acd7b3712482df0",
  "assumptions": [
    "months are calendar months in UTC"
  ],
  "disclosure": {
    "level": "full",
    "withheld_rows": 0
  }
}
